{
  "schema_version": "m-c0-session-1.0",
  "status": "pilot",
  "session_id": "M-C0-20260818-CAP3-EMPTY-01",
  "subject_id": "SUBJ-NONE",
  "operator_id": "OP-LOCAL-001",
  "start_time_utc": "2026-08-18T01:20:25.535Z",
  "end_time_utc": "2026-08-18T01:24:25.536Z",
  "sensor": {
    "model": "MR60BHA2",
    "transport": "ESP32_UART_USB",
    "firmware_version": "safenest-mr60-esp/1.2.0",
    "sensor_firmware_version": "UNKNOWN_NOT_REPORTED",
    "config_hash": "b817e8bfd5e52b18275626f7b6a9bd60098ea4b108428a5aaf63600dbc987834",
    "device_id": "safenest-node-01"
  },
  "setup": {
    "distance_cm": 0,
    "sensor_height_cm": 100,
    "sensor_angle_deg": 100,
    "orientation": "sensor_unchanged_no_target",
    "posture": "none_room_unoccupied",
    "clothing": "not_applicable",
    "bedding": "none",
    "environment": "indoor_office_or_lab",
    "other_people_present": false,
    "other_people_distance_m": null,
    "background_movement": "none_room_vacated"
  },
  "condition": {
    "breathing_mode": "safe_observation",
    "movement_context": "unoccupied_room_no_subject_present",
    "notes": "CAP-3 unoccupied-room reference. No human subject; subject_id SUBJ-NONE is a placeholder, not a person. Same sensor placement as the CAP-2/CAP-3 occupied sessions with the operator out of the room. distance_cm=0 records that no target distance existed; distance_cm_raw was null on all 2400 records. Producer reported PRESENCE_NOT_DETECTED and human_detected_stable=false on all 2400 records, and breath_phase was exactly 0.0 with a single distinct value. This session exists to supply device-side evidence for the presence-gating hazard reported by the model track in M-N7: all 8 canonical windows were ACCEPTED by M-N4 with MAD=0 and mad_collapsed=true, i.e. zero tensors. M-N4 does not reject unoccupied input; only a presence gate can. The producer signal needed for that gate is unambiguous here."
  },
  "reference": {
    "type": "none",
    "independent": false,
    "synchronized": false,
    "status": "not_collected",
    "file": null,
    "notes": "INDEPENDENT_REFERENCE = NOT_AVAILABLE. No respiration or heart accuracy claim. Contract-designated reference (MOVESENSE_CHEST_ACC) is not available to this track."
  },
  "files": {
    "raw_immutable": true,
    "raw_jsonl": [
      {
        "path": "raw/M-C0-20260818-CAP3-EMPTY-01.jsonl",
        "sha256": "834c368fc0daf21d219814d21e8cca1901400daf715e19128294a5e847b2a321",
        "record_count": 2400,
        "byte_count": 2446061
      }
    ]
  },
  "privacy": {
    "identifiers_removed": true,
    "video_collected": false,
    "third_party_visible": false,
    "consent_or_workplace_permission": "No person present. No identifying media collected."
  },
  "qa": {
    "status": "pass_with_limitations",
    "validator_version": "m-c0-validator-1.1",
    "notes": "Stream integrity passed: 0 uart/checksum errors, 0 seq gaps, 0 gaps over 500ms, max gap 101ms. M-N4 canonical yield 8 of 8 windows accepted, all MAD=0 zero tensors. Classified FAILURE_QA_EVIDENCE / presence-gate evidence, NOT training or characterization data. Contains no respiration signal by construction."
  }
}
